{
  "schema_version": "state-graph.v1",
  "reference": {
    "package": "com.gdzsq.crazy_td",
    "capture_meta_evidence_id": "EV-0191"
  },
  "nodes": [
    {
      "id": "ST-0001",
      "evidence_tier": "behavioral_and_visual",
      "visual_status": "usable",
      "visual_evidence_ids": ["EV-0233"],
      "kind": "screen",
      "parent": null,
      "route": "launch",
      "phase": "idle",
      "semantic_flags": {
        "clean_launch": true,
        "reference_ip_visible": true
      },
      "visible_affordances": [
        {
          "id": "AF-0001",
          "bounds_unavailable_reason": "G1-BL-010: GameCanvas exposes no measurable child bounds; coordinates are not invented.",
          "role": "primary_action",
          "action": "start_game",
          "bounds_dp": null,
          "coverage_status": "edge",
          "coverage_ref": "ED-0001"
        }
      ],
      "signatures": {
        "structural": {
          "activity": "com.gdzsq.crazy_td/.MainActivity",
          "normalized_affordances": [
            "primary_start"
          ],
          "digest": "052c68c4a3f125b011cdf8f9100a36331409c129e6bcb7cb886a4ba47d07865d"
        },
        "visual": {
          "algorithm": "dct-phash-64-masked",
          "perceptual_hash": "090dba5ae727354c",
          "distance_threshold": 8,
          "masked_regions": []
        },
        "semantic": {
          "route": "launch",
          "overlay": null,
          "battle_phase": null,
          "flags": {
            "clean_launch": true
          },
          "digest": "808cfe5fe3864fef8e025ca56893c70f98dbb4c477b1e1534dc8ac3ecb5d1153"
        }
      },
      "evidence_ids": [
        "EV-0001",
        "EV-0127",
        "EV-0169",
        "EV-0233"
      ],
      "source": "observed",
      "confidence": 0.98
    },
    {
      "id": "ST-0002",
      "evidence_tier": "behavioral",
      "visual_status": "preserved_unusable",
      "visual_evidence_ids": [],
      "kind": "battle_phase",
      "parent": null,
      "route": "battle",
      "phase": "setup",
      "semantic_flags": {
        "level": "Lv1",
        "tutorial_overlay_seen": true,
        "initial_options_seen": 3
      },
      "visible_affordances": [
        {
          "id": "AF-0002",
          "bounds_unavailable_reason": "G1-BL-010: GameCanvas exposes no measurable child bounds; coordinates are not invented.",
          "role": "choice",
          "action": "select_initial_option_a",
          "bounds_dp": null,
          "coverage_status": "edge",
          "coverage_ref": "ED-0002"
        },
        {
          "id": "AF-0003",
          "bounds_unavailable_reason": "G1-BL-010: GameCanvas exposes no measurable child bounds; coordinates are not invented.",
          "role": "choice",
          "action": "select_initial_option_b",
          "bounds_dp": null,
          "coverage_status": "edge",
          "coverage_ref": "ED-0003"
        },
        {
          "id": "AF-0004",
          "bounds_unavailable_reason": "G1-BL-010: GameCanvas exposes no measurable child bounds; coordinates are not invented.",
          "role": "choice",
          "action": "select_initial_option_c",
          "bounds_dp": null,
          "coverage_status": "edge",
          "coverage_ref": "ED-0004"
        },
        {
          "id": "AF-0005",
          "bounds_unavailable_reason": "G1-BL-010: GameCanvas exposes no measurable child bounds; coordinates are not invented.",
          "role": "secondary_action",
          "action": "continue_tutorial_setup",
          "bounds_dp": null,
          "coverage_status": "edge",
          "coverage_ref": "ED-0005"
        },
        {
          "id": "AF-0006",
          "bounds_unavailable_reason": "G1-BL-010: GameCanvas exposes no measurable child bounds; coordinates are not invented.",
          "role": "primary_action",
          "action": "start_battle",
          "bounds_dp": null,
          "coverage_status": "edge",
          "coverage_ref": "ED-0006"
        }
      ],
      "signatures": {
        "structural": {
          "activity": "com.gdzsq.crazy_td/.MainActivity",
          "normalized_affordances": [
            "choice_a",
            "choice_b",
            "choice_c",
            "continue",
            "start_battle"
          ],
          "digest": "f257bc1f988b037ba6346ab962c7d23a40db37f6d811f404bc252dc274db1aef"
        },
        "visual": {
          "algorithm": "dct-phash-64-masked",
          "perceptual_hash": "181c1d454f6ee85d",
          "distance_threshold": 8,
          "masked_regions": [
            {
              "reason": "currency",
              "bounds_dp": {
                "left": 0,
                "top": 0,
                "right": 220,
                "bottom": 120
              }
            }
          ]
        },
        "semantic": {
          "route": "battle",
          "overlay": null,
          "battle_phase": "setup",
          "flags": {
            "level": "Lv1",
            "tutorial_overlay_seen": true
          },
          "digest": "9cb789de48f9d4491e64443cfaaa7a8c3e8da04f041124831d553895f5f648ab"
        }
      },
      "evidence_ids": [
        "EV-0003",
        "EV-0017",
        "EV-0115",
        "EV-0179"
      ],
      "source": "observed",
      "confidence": 0.95
    },
    {
      "id": "ST-0003",
      "evidence_tier": "behavioral",
      "visual_status": "deferred_missing_signature",
      "visual_evidence_ids": ["EV-0243"],
      "kind": "battle_phase",
      "parent": null,
      "route": "battle",
      "phase": "active_wave",
      "semantic_flags": {
        "level": "Lv1",
        "waves_total": 5,
        "enemy_entities_visible": true,
        "base_visible": true
      },
      "visible_affordances": [
        {
          "id": "AF-0007",
          "bounds_unavailable_reason": "G1-BL-010: GameCanvas exposes no measurable child bounds; coordinates are not invented.",
          "role": "speed_control",
          "action": "change_battle_speed",
          "bounds_dp": null,
          "coverage_status": "edge",
          "coverage_ref": "ED-0007"
        },
        {
          "id": "AF-0008",
          "bounds_unavailable_reason": "G1-BL-010: GameCanvas exposes no measurable child bounds; coordinates are not invented.",
          "role": "pause_control",
          "action": "pause_or_resume_battle",
          "bounds_dp": null,
          "coverage_status": "edge",
          "coverage_ref": "ED-0008"
        },
        {
          "id": "AF-0009",
          "bounds_unavailable_reason": "G1-BL-010: GameCanvas exposes no measurable child bounds; coordinates are not invented.",
          "role": "build_action",
          "action": "build_available_structure",
          "bounds_dp": null,
          "coverage_status": "edge",
          "coverage_ref": "ED-0009"
        },
        {
          "id": "AF-0010",
          "bounds_unavailable_reason": "G1-BL-010: GameCanvas exposes no measurable child bounds; coordinates are not invented.",
          "role": "phase_action",
          "action": "open_enhancement_choice",
          "bounds_dp": null,
          "coverage_status": "edge",
          "coverage_ref": "ED-0010"
        }
      ],
      "signatures": {
        "structural": {
          "activity": "com.gdzsq.crazy_td/.MainActivity",
          "normalized_affordances": [
            "speed",
            "pause",
            "build",
            "phase_transition"
          ],
          "digest": "88272a9395848a80b0317467479c6e171cd384817a136502951dd6dbc60f6597"
        },
        "visual": {
          "algorithm": "manual_capture",
          "perceptual_hash": null,
          "distance_threshold": null,
          "masked_regions": [
            {
              "reason": "wave",
              "bounds_dp": {
                "left": 420,
                "top": 0,
                "right": 680,
                "bottom": 130
              }
            },
            {
              "reason": "hp",
              "bounds_dp": {
                "left": 0,
                "top": 1700,
                "right": 1080,
                "bottom": 2424
              }
            }
          ]
        },
        "semantic": {
          "route": "battle",
          "overlay": null,
          "battle_phase": "active_wave",
          "flags": {
            "waves_total": 5,
            "enemy_entities_visible": true
          },
          "digest": "cbce38482f893ab79cdef4ae611aef6764d6eed219076e172da69b302a07d532"
        }
      },
      "evidence_ids": [
        "EV-0023",
        "EV-0121",
        "EV-0243"
      ],
      "source": "observed",
      "confidence": 0.92
    },
    {
      "id": "ST-0004",
      "evidence_tier": "behavioral",
      "visual_status": "preserved_unusable",
      "visual_evidence_ids": [],
      "kind": "overlay",
      "parent": "ST-0003",
      "route": "battle",
      "phase": "enhancement_choice",
      "semantic_flags": {
        "refresh_visible": true,
        "all_filter_visible": true,
        "offers_observed": true
      },
      "visible_affordances": [
        {
          "id": "AF-0011",
          "bounds_unavailable_reason": "G1-BL-010: GameCanvas exposes no measurable child bounds; coordinates are not invented.",
          "role": "choice",
          "action": "select_enhancement_offer",
          "bounds_dp": null,
          "coverage_status": "edge",
          "coverage_ref": "ED-0011"
        },
        {
          "id": "AF-0012",
          "bounds_unavailable_reason": "G1-BL-010: GameCanvas exposes no measurable child bounds; coordinates are not invented.",
          "role": "secondary_action",
          "action": "refresh_enhancement_offers",
          "bounds_dp": null,
          "coverage_status": "edge",
          "coverage_ref": "ED-0012"
        }
      ],
      "signatures": {
        "structural": {
          "activity": "com.gdzsq.crazy_td/.MainActivity",
          "normalized_affordances": [
            "enhancement_offer",